{
  "job_id": "job-auto-dream-20260810-0104-native-window-v000-2dscreen-s88104",
  "parent_room": "room-g001-a",
  "override": {
    "param": "noise_amplitude",
    "to": 0.0003
  },
  "seed": 88104,
  "requested_at": 1786358440.6645043,
  "status": "done",
  "progress": 1.0,
  "result_room": "room-auto-dream-20260810-0104-native-window-v000-2dscreen-s88104",
  "reached_level": 1,
  "checksum": "7a222c855cdb8ecc",
  "measured_by": {
    "defect_count": 8,
    "mean_amplitude_growth": 4557.8875,
    "persistent_defects": false,
    "structure_factor_prominence": 27.3247
  }
}