{
  "job_id": "job-auto-gl-haiku-1000-robustness-h001-v006-local3d-s0003",
  "parent_room": "room-g001-a",
  "override": {
    "param": "noise_amplitude",
    "to": 1e-05
  },
  "seed": 3,
  "requested_at": 1786007493.6503196,
  "status": "done",
  "progress": 1.0,
  "result_room": "room-auto-gl-haiku-1000-robustness-h001-v006-local3d-s0003",
  "reached_level": 1,
  "checksum": "1cc2ff97975afa67",
  "measured_by": {
    "defect_count": 0,
    "mean_amplitude_growth": 145033.2328,
    "persistent_defects": false,
    "structure_factor_prominence": 16.9648
  }
}