{
  "job_id": "job-auto-dream-20260822-0376-native-window-v000-local3d-s89578",
  "parent_room": "room-g001-a",
  "override": {
    "param": "noise_amplitude",
    "to": 0.0001
  },
  "seed": 89578,
  "requested_at": 1787420527.163599,
  "status": "done",
  "progress": 1.0,
  "result_room": "room-auto-dream-20260822-0376-native-window-v000-local3d-s89578",
  "reached_level": 1,
  "checksum": "aab2b9db2aed9e66",
  "measured_by": {
    "defect_count": 0,
    "mean_amplitude_growth": 5.5513,
    "persistent_defects": false,
    "structure_factor_prominence": 16.9986
  }
}