{
  "job_id": "job-auto-dream-20260829-0523-native-window-v000-coarseglobal3d-s90423",
  "parent_room": "room-g001-a",
  "override": {
    "param": "noise_amplitude",
    "to": 0.003
  },
  "seed": 90423,
  "requested_at": 1787985591.7660089,
  "status": "queued",
  "progress": 0.0,
  "reason": "waiting_approval:coarse-global-3d"
}