{
  "job_id": "job-auto-gl-haiku-1000-robustness-h001-v034-local3d-s0002",
  "parent_room": "room-g001-a",
  "override": {
    "param": "noise_amplitude",
    "to": 2.97635e-05
  },
  "seed": 2,
  "requested_at": 1786007496.4485276,
  "status": "done",
  "progress": 1.0,
  "result_room": "room-auto-gl-haiku-1000-robustness-h001-v034-local3d-s0002",
  "reached_level": 1,
  "checksum": "99094613ac513cc1",
  "measured_by": {
    "defect_count": 0,
    "mean_amplitude_growth": 68528.0766,
    "persistent_defects": false,
    "structure_factor_prominence": 16.911
  }
}