{
  "job_id": "job-auto-dream-20260916-0962-native-window-v000-2dscreen-s99564",
  "parent_room": "room-g001-a",
  "override": {
    "param": "noise_amplitude",
    "to": 0.01
  },
  "seed": 99564,
  "requested_at": 1789575938.8230405,
  "status": "done",
  "progress": 1.0,
  "result_room": "room-auto-dream-20260916-0962-native-window-v000-2dscreen-s99564",
  "reached_level": 2,
  "checksum": "94e745b5442160ed",
  "measured_by": {
    "defect_count": 8,
    "mean_amplitude_growth": 140.1042,
    "persistent_defects": true,
    "structure_factor_prominence": 28.1836
  }
}