{
  "job_id": "job-auto-gl-haiku-1000-robustness-h001-v179-local3d-s0002",
  "parent_room": "room-g001-a",
  "override": {
    "param": "noise_amplitude",
    "to": 0.0048329302
  },
  "seed": 2,
  "requested_at": 1786007517.1307287,
  "status": "done",
  "progress": 1.0,
  "result_room": "room-auto-gl-haiku-1000-robustness-h001-v179-local3d-s0002",
  "reached_level": 1,
  "checksum": "d94645f1072061be",
  "measured_by": {
    "defect_count": 0,
    "mean_amplitude_growth": 290.9501,
    "persistent_defects": false,
    "structure_factor_prominence": 16.9731
  }
}