{
  "job_id": "job-auto-gl-haiku-1000-robustness-h001-v067-2dscreen-s0000",
  "parent_room": "room-g001-a",
  "override": {
    "param": "noise_amplitude",
    "to": 8.85867e-05
  },
  "seed": 0,
  "requested_at": 1786007471.515743,
  "status": "done",
  "progress": 1.0,
  "result_room": "room-auto-gl-haiku-1000-robustness-h001-v067-2dscreen-s0000",
  "reached_level": 1,
  "checksum": "b50162a9701188fa",
  "measured_by": {
    "defect_count": 4,
    "mean_amplitude_growth": 16062.8056,
    "persistent_defects": false,
    "structure_factor_prominence": 29.4854
  }
}