{
  "job_id": "job-auto-gl-haiku-1000-robustness-h001-v147-2dscreen-s0001",
  "parent_room": "room-g001-a",
  "override": {
    "param": "noise_amplitude",
    "to": 0.0016237767
  },
  "seed": 1,
  "requested_at": 1786007471.5254693,
  "status": "done",
  "progress": 1.0,
  "result_room": "room-auto-gl-haiku-1000-robustness-h001-v147-2dscreen-s0001",
  "reached_level": 2,
  "checksum": "2345ee7028e86fdf",
  "measured_by": {
    "defect_count": 4,
    "mean_amplitude_growth": 880.5252,
    "persistent_defects": true,
    "structure_factor_prominence": 29.9883
  }
}