{
  "job_id": "job-auto-gl-haiku-1000-robustness-h001-v060-2dscreen-s0001",
  "parent_room": "room-g001-a",
  "override": {
    "param": "noise_amplitude",
    "to": 8.85867e-05
  },
  "seed": 1,
  "requested_at": 1786007471.5149484,
  "status": "done",
  "progress": 1.0,
  "result_room": "room-auto-gl-haiku-1000-robustness-h001-v060-2dscreen-s0001",
  "reached_level": 2,
  "checksum": "194df913c4ce6086",
  "measured_by": {
    "defect_count": 4,
    "mean_amplitude_growth": 16137.192,
    "persistent_defects": true,
    "structure_factor_prominence": 29.8681
  }
}